<?xml version="1.0" encoding="UTF-8"?>
<venda moeda="real" xsi:noNamespaceSchemaLocation="venda.xsd" xmlns:xsi="http://www.w3.org/2001/XMLSchema-instance">
	<formaDePagamento>Cart√£o</formaDePagamento>
	<endereco>Rua Aclimacao</endereco>
	<produtos>
		<produto>
			<nome>Livro de XML</nome>
			<preco>29.90</preco>
		</produto>
		<produto>
			<nome>Livro de OO em Java</nome>
			<preco>29.90</preco>
		</produto>
	</produtos>
</venda>